[
  {
    "id": "fixture:jeronimos",
    "name": "Mosteiro dos Jerónimos",
    "lat": 38.6979,
    "lon": -9.2065,
    "categories": ["monument", "church"],
    "typical_duration_minutes": 90,
    "cost": { "amount": 12.0, "currency": "EUR", "confidence": "inferred" },
    "hours": {
      "mon": null,
      "tue": [["09:30", "18:00"]],
      "wed": [["09:30", "18:00"]],
      "thu": [["09:30", "18:00"]],
      "fri": [["09:30", "18:00"]],
      "sat": [["09:30", "18:00"]],
      "sun": [["09:30", "18:00"]],
      "confidence": "inferred"
    },
    "rating": 4.7,
    "popularity": 0.95,
    "source": "fixture"
  },
  {
    "id": "fixture:torre-belem",
    "name": "Torre de Belém",
    "lat": 38.6916,
    "lon": -9.2160,
    "categories": ["monument", "landmark"],
    "typical_duration_minutes": 60,
    "cost": { "amount": 8.0, "currency": "EUR", "confidence": "inferred" },
    "hours": {
      "mon": null,
      "tue": [["09:30", "17:30"]],
      "wed": [["09:30", "17:30"]],
      "thu": [["09:30", "17:30"]],
      "fri": [["09:30", "17:30"]],
      "sat": [["09:30", "17:30"]],
      "sun": [["09:30", "17:30"]],
      "confidence": "inferred"
    },
    "rating": 4.6,
    "popularity": 0.9,
    "source": "fixture"
  },
  {
    "id": "fixture:padrao-descobrimentos",
    "name": "Padrão dos Descobrimentos",
    "lat": 38.6936,
    "lon": -9.2059,
    "categories": ["monument", "viewpoint"],
    "typical_duration_minutes": 45,
    "cost": { "amount": 10.0, "currency": "EUR", "confidence": "inferred" },
    "hours": {
      "mon": null,
      "tue": [["10:00", "19:00"]],
      "wed": [["10:00", "19:00"]],
      "thu": [["10:00", "19:00"]],
      "fri": [["10:00", "19:00"]],
      "sat": [["10:00", "19:00"]],
      "sun": [["10:00", "19:00"]],
      "confidence": "inferred"
    },
    "rating": 4.5,
    "popularity": 0.75,
    "source": "fixture"
  },
  {
    "id": "fixture:pasteis-de-belem",
    "name": "Pastéis de Belém",
    "lat": 38.6975,
    "lon": -9.2033,
    "categories": ["bakery", "cafe"],
    "typical_duration_minutes": 30,
    "cost": { "amount": 6.0, "currency": "EUR", "confidence": "inferred" },
    "hours": {
      "mon": [["08:00", "22:00"]],
      "tue": [["08:00", "22:00"]],
      "wed": [["08:00", "22:00"]],
      "thu": [["08:00", "22:00"]],
      "fri": [["08:00", "22:00"]],
      "sat": [["08:00", "22:00"]],
      "sun": [["08:00", "22:00"]],
      "confidence": "inferred"
    },
    "rating": 4.5,
    "popularity": 0.92,
    "source": "fixture"
  },
  {
    "id": "fixture:museu-azulejo",
    "name": "Museu Nacional do Azulejo",
    "lat": 38.7247,
    "lon": -9.1139,
    "categories": ["museum"],
    "typical_duration_minutes": 90,
    "cost": { "amount": 5.0, "currency": "EUR", "confidence": "inferred" },
    "hours": {
      "mon": null,
      "tue": [["10:00", "18:00"]],
      "wed": [["10:00", "18:00"]],
      "thu": [["10:00", "18:00"]],
      "fri": [["10:00", "18:00"]],
      "sat": [["10:00", "18:00"]],
      "sun": [["10:00", "18:00"]],
      "confidence": "inferred"
    },
    "rating": 4.6,
    "popularity": 0.6,
    "source": "fixture"
  },
  {
    "id": "fixture:castelo-sao-jorge",
    "name": "Castelo de São Jorge",
    "lat": 38.7139,
    "lon": -9.1335,
    "categories": ["castle", "viewpoint"],
    "typical_duration_minutes": 120,
    "cost": { "amount": 15.0, "currency": "EUR", "confidence": "inferred" },
    "hours": {
      "mon": [["09:00", "21:00"]],
      "tue": [["09:00", "21:00"]],
      "wed": [["09:00", "21:00"]],
      "thu": [["09:00", "21:00"]],
      "fri": [["09:00", "21:00"]],
      "sat": [["09:00", "21:00"]],
      "sun": [["09:00", "21:00"]],
      "confidence": "inferred"
    },
    "rating": 4.5,
    "popularity": 0.88,
    "source": "fixture"
  },
  {
    "id": "fixture:se-lisboa",
    "name": "Sé de Lisboa (Cathedral)",
    "lat": 38.7098,
    "lon": -9.1330,
    "categories": ["church"],
    "typical_duration_minutes": 45,
    "cost": { "amount": 5.0, "currency": "EUR", "confidence": "inferred" },
    "hours": {
      "mon": [["10:00", "18:00"]],
      "tue": [["10:00", "18:00"]],
      "wed": [["10:00", "18:00"]],
      "thu": [["10:00", "18:00"]],
      "fri": [["10:00", "18:00"]],
      "sat": [["10:00", "18:00"]],
      "sun": null,
      "confidence": "inferred"
    },
    "rating": 4.4,
    "popularity": 0.65,
    "source": "fixture"
  },
  {
    "id": "fixture:miradouro-senhora-monte",
    "name": "Miradouro da Senhora do Monte",
    "lat": 38.7188,
    "lon": -9.1305,
    "categories": ["viewpoint"],
    "typical_duration_minutes": 30,
    "cost": { "amount": 0.0, "currency": "EUR", "confidence": "known" },
    "hours": {
      "mon": [["00:00", "23:59"]],
      "tue": [["00:00", "23:59"]],
      "wed": [["00:00", "23:59"]],
      "thu": [["00:00", "23:59"]],
      "fri": [["00:00", "23:59"]],
      "sat": [["00:00", "23:59"]],
      "sun": [["00:00", "23:59"]],
      "confidence": "inferred"
    },
    "rating": 4.7,
    "popularity": 0.7,
    "source": "fixture"
  },
  {
    "id": "fixture:miradouro-sao-pedro-alcantara",
    "name": "Miradouro de São Pedro de Alcântara",
    "lat": 38.7150,
    "lon": -9.1440,
    "categories": ["viewpoint"],
    "typical_duration_minutes": 30,
    "cost": { "amount": 0.0, "currency": "EUR", "confidence": "known" },
    "hours": {
      "mon": [["00:00", "23:59"]],
      "tue": [["00:00", "23:59"]],
      "wed": [["00:00", "23:59"]],
      "thu": [["00:00", "23:59"]],
      "fri": [["00:00", "23:59"]],
      "sat": [["00:00", "23:59"]],
      "sun": [["00:00", "23:59"]],
      "confidence": "inferred"
    },
    "rating": 4.6,
    "popularity": 0.72,
    "source": "fixture"
  },
  {
    "id": "fixture:time-out-market",
    "name": "Time Out Market (Mercado da Ribeira)",
    "lat": 38.7071,
    "lon": -9.1459,
    "categories": ["market", "restaurant"],
    "typical_duration_minutes": 75,
    "cost": { "amount": 20.0, "currency": "EUR", "confidence": "inferred" },
    "hours": {
      "mon": [["10:00", "23:59"]],
      "tue": [["10:00", "23:59"]],
      "wed": [["10:00", "23:59"]],
      "thu": [["10:00", "23:59"]],
      "fri": [["10:00", "23:59"]],
      "sat": [["10:00", "23:59"]],
      "sun": [["10:00", "23:59"]],
      "confidence": "inferred"
    },
    "rating": 4.4,
    "popularity": 0.9,
    "source": "fixture"
  },
  {
    "id": "fixture:praca-comercio",
    "name": "Praça do Comércio",
    "lat": 38.7075,
    "lon": -9.1364,
    "categories": ["landmark", "neighborhood"],
    "typical_duration_minutes": 30,
    "cost": { "amount": 0.0, "currency": "EUR", "confidence": "known" },
    "hours": {
      "mon": [["00:00", "23:59"]],
      "tue": [["00:00", "23:59"]],
      "wed": [["00:00", "23:59"]],
      "thu": [["00:00", "23:59"]],
      "fri": [["00:00", "23:59"]],
      "sat": [["00:00", "23:59"]],
      "sun": [["00:00", "23:59"]],
      "confidence": "inferred"
    },
    "rating": 4.6,
    "popularity": 0.85,
    "source": "fixture"
  },
  {
    "id": "fixture:elevador-santa-justa",
    "name": "Elevador de Santa Justa",
    "lat": 38.7120,
    "lon": -9.1394,
    "categories": ["landmark", "viewpoint"],
    "typical_duration_minutes": 30,
    "cost": { "amount": 5.0, "currency": "EUR", "confidence": "inferred" },
    "hours": {
      "mon": [["08:00", "22:00"]],
      "tue": [["08:00", "22:00"]],
      "wed": [["08:00", "22:00"]],
      "thu": [["08:00", "22:00"]],
      "fri": [["08:00", "22:00"]],
      "sat": [["08:00", "22:00"]],
      "sun": [["08:00", "22:00"]],
      "confidence": "inferred"
    },
    "rating": 4.2,
    "popularity": 0.78,
    "source": "fixture"
  },
  {
    "id": "fixture:lx-factory",
    "name": "LX Factory",
    "lat": 38.7027,
    "lon": -9.1786,
    "categories": ["neighborhood", "shop"],
    "typical_duration_minutes": 90,
    "cost": { "amount": 0.0, "currency": "EUR", "confidence": "known" },
    "hours": {
      "mon": [["08:00", "23:59"]],
      "tue": [["08:00", "23:59"]],
      "wed": [["08:00", "23:59"]],
      "thu": [["08:00", "23:59"]],
      "fri": [["08:00", "23:59"]],
      "sat": [["08:00", "23:59"]],
      "sun": [["08:00", "23:59"]],
      "confidence": "inferred"
    },
    "rating": 4.4,
    "popularity": 0.7,
    "source": "fixture"
  },
  {
    "id": "fixture:gulbenkian",
    "name": "Museu Calouste Gulbenkian",
    "lat": 38.7377,
    "lon": -9.1537,
    "categories": ["museum", "gallery"],
    "typical_duration_minutes": 120,
    "cost": { "amount": 10.0, "currency": "EUR", "confidence": "inferred" },
    "hours": {
      "mon": [["10:00", "18:00"]],
      "tue": null,
      "wed": [["10:00", "18:00"]],
      "thu": [["10:00", "18:00"]],
      "fri": [["10:00", "18:00"]],
      "sat": [["10:00", "18:00"]],
      "sun": [["10:00", "18:00"]],
      "confidence": "inferred"
    },
    "rating": 4.7,
    "popularity": 0.68,
    "source": "fixture"
  },
  {
    "id": "fixture:jardim-estrela",
    "name": "Jardim da Estrela",
    "lat": 38.7139,
    "lon": -9.1607,
    "categories": ["park", "garden"],
    "typical_duration_minutes": 45,
    "cost": { "amount": 0.0, "currency": "EUR", "confidence": "known" },
    "hours": {
      "mon": [["07:00", "22:00"]],
      "tue": [["07:00", "22:00"]],
      "wed": [["07:00", "22:00"]],
      "thu": [["07:00", "22:00"]],
      "fri": [["07:00", "22:00"]],
      "sat": [["07:00", "22:00"]],
      "sun": [["07:00", "22:00"]],
      "confidence": "inferred"
    },
    "rating": 4.5,
    "popularity": 0.5,
    "source": "fixture"
  },
  {
    "id": "fixture:cervejaria-ramiro",
    "name": "Cervejaria Ramiro",
    "lat": 38.7223,
    "lon": -9.1356,
    "categories": ["restaurant"],
    "typical_duration_minutes": 90,
    "cost": { "amount": 35.0, "currency": "EUR", "confidence": "inferred" },
    "hours": {
      "mon": null,
      "tue": [["12:00", "23:59"]],
      "wed": [["12:00", "23:59"]],
      "thu": [["12:00", "23:59"]],
      "fri": [["12:00", "23:59"]],
      "sat": [["12:00", "23:59"]],